Chapter,hanzi,meaning,example_en,usage_note
Chapter 8,效犬马之劳,vous servir comme un chien fidèle ou un cheval,"Si vous avez besoin d'aide, je suis prêt à vous servir au mieux de mes capacités.",Offre formelle et humble de service.
Chapter 8,弱势群体,groupes vulnérables; populations défavorisées,Les bénévoles visitent régulièrement la communauté pour fournir des produits de première nécessité quotidiens aux groupes vulnérables.,Terme officiel et médiatique.
Chapter 8,真人秀,spectacle de réalité,Beaucoup de jeunes aiment la réalité parce qu'ils se sentent proches de la vie quotidienne.,Vocabulaire du divertissement.
Chapter 8,两眼一抹黑,être complètement dans le noir,"Il venait d'entrer dans une nouvelle industrie et était complètement dans le noir, donc il a dû apprendre de zéro.",Souligne le manque de connaissance.
Chapter 8,孤寡老人,personnes âgées sans soutien familial,Des bénévoles communautaires visitent des personnes âgées sans soutien familial chaque semaine pour discuter avec elles.,Contexte social.
Chapter 8,空巢老人,âgés de moins de 5 ans,Beaucoup de personnes âgées qui n'ont pas de nid ont besoin de services de garderie de la collectivité.,Terme démographique commun.
Chapter 8,临终关怀,soins palliatifs; soins de fin de vie,L'hôpital fournit des soins de fin de vie afin que les patients en phase terminale puissent partir avec dignité.,Vocabulaire médical et éthique.
Chapter 8,勿以善小而不为,ne manque pas de faire le bien parce qu'il semble petit,Le montant donné n'a pas d'importance — ne manquez pas de faire le bien parce qu'il semble petit; tout aide.,De l'enseignement moral classique.
Chapter 9,咨询,consulter; demander conseil,"Si vous avez des questions, vous pouvez appeler le numéro de consultation.",Enquête professionnelle.
Chapter 9,体检,examen physique; contrôle,"Pour la santé, nous devrions subir un examen physique une fois par an.",Contrôle médical.
Chapter 9,记性,mémoire,"Quand les gens vieillissent, leur mémoire s'aggrave.",Terme informel pour mémoire.
Chapter 9,够呛,insupportable; terrible,Il y avait tellement de travail aujourd'hui ; ça m'a terriblement usé.,Extrême degré.
Chapter 9,总管,Directeur général,"Il est le gestionnaire de ce projet, responsable de la coordination de toutes les parties.",Leader général.
Chapter 9,担子,charge; charge; responsabilité,"Comme le moniteur de classe, le fardeau sur ses épaules n'est pas léger.",Poids symbolique du droit.
Chapter 9,介于,entre; intermédiaire,Cette couleur est entre rouge et violet.,Position dans une portée.
Chapter 9,减退,déclin; baisse,"À mesure que l'âge augmente, l'audition diminue progressivement.",Baisse de la force.
Chapter 9,疲乏,fatigue; fatigue,"Après le long voyage, il se sentait très fatigué.",La fatigue physique.
Chapter 9,健忘,Oubliant,"En raison de trop de pression dernièrement, il est devenu un peu oublié.",C'est évident.
Chapter 9,不良,mauvais; nocif; malsain,Rester debout tard à long terme est une habitude malsaine qui est très mauvaise pour le corps.,Qualité négative.
Chapter 9,酗酒,boisson excessive; alcoolisme,"L'alcool excessif non seulement blesse le corps, mais peut aussi causer des problèmes sociaux.",Abus d'alcool.
Chapter 9,膳食,régime alimentaire; repas,Un régime alimentaire raisonnable est crucial pour maintenir une bonne santé.,Durée formelle des repas/nutrition.
Chapter 9,失衡,déséquilibre; déséquilibre,Cette façon de manger conduira à un déséquilibre des oligo-éléments dans le corps.,Perte d'équilibre.
Chapter 9,祸根,racine du problème; bâillon,Les mauvaises habitudes alimentaires sont la cause profonde de nombreuses maladies.,Origine du désastre.
Chapter 9,应酬,socialisation; dîner,Il a des engagements sociaux tous les soirs et mange rarement à la maison.,Obligations professionnelles et sociales.
Chapter 9,硬撑,tenir bon; tenir bon malgré les difficultés,"Si vous êtes malade, vous devriez vous reposer; ne vous forcez pas à aller travailler.",La lutte pour continuer.
Chapter 9,天长日久,après une longue période; au fil des années,"Tant que vous persisterez sur une longue période, vous réussirez sûrement.",Durée continue.
Chapter 9,恶果,mauvaise conséquence; mauvais résultat,Les actes de destruction environnementale finiront par avoir de graves conséquences.,Résultat de mauvaises actions.
Chapter 9,屡见不鲜,rien de nouveau; événement fréquent,"À l'ère de l'Internet, les incidents de fuite de données sont déjà fréquents.",Vu souvent.
Chapter 9,延续,continuer; se prolonger,Cette tradition ancienne a continué jusqu'à aujourd'hui.,Extension non interrompue.
Chapter 9,全天候,tous les jours; 24 heures sur 24,Ce dépanneur offre un service 24h/24.,Service/opération continu.
Chapter 9,熬夜,rester debout tard; rester debout toute la nuit,"Pour finir ce rapport, il est resté debout jusqu'à 3 h hier soir.",Dormir tard/pas du tout.
Chapter 9,宵夜,collation de minuit; souper,"Après avoir regardé le film, allons prendre une collation de minuit ensemble.",Repas tard dans la nuit.
Chapter 9,满满当当,plein au bord; emballé,Son emploi du temps est plein tous les jours.,Il ne reste plus d'espace.
Chapter 9,透支,ouverdraw; surexert,Le surmenage mettra le corps dans un état de surmenage/drain sévère.,Utilisation plus que disponible.
Chapter 9,张弛有度,équilibre entre le travail et le repos,Les méthodes d'études scientifiques devraient comporter un équilibre entre le travail et le repos.,"Littérale: ""tension et relaxation en mesure."""
Chapter 9,基因,gène,La recherche scientifique a révélé que la hauteur est largement déterminée par les gènes.,Unité biologique.
Chapter 9,遗传,hérédité; hériter,Cette maladie a une nette tendance héréditaire familiale.,Passage biologique des traits.
Chapter 9,吓唬,peur; peur,"Il te fait peur, ne le prends pas au sérieux.",Intimidation (informel).
Chapter 9,语重心长,sincère et profond; paroles du fond du cœur,"Avant de partir, le professeur m'a vivement conseillé de prendre soin de moi.",Un discours profondément ressenti.
Chapter 9,灵丹妙药,médecine miracle; panacée,L'exercice est un médicament miracle pour maintenir la santé.,Cure-all (souvent utilisé figurément).
Chapter 9,均衡,équilibré; même,Nous devons maintenir une alimentation équilibrée et manger plus de fruits et de légumes.,Même la distribution.
Chapter 9,开朗,joyeux; optimiste,"C'est une fille joyeuse, tout le monde aime être amie avec elle.",Une disposition ensoleillée.
Chapter 9,平和,doux; doux; calme,Son attitude est toujours très calme dans la gestion des conflits.,Pas agressif.
Chapter 9,神清气爽,rafraîchissant; tête claire et rafraîchi,Prendre une promenade dans les montagnes tôt le matin fait se sentir rafraîchi.,Fraîcheur mentale/physique.
Chapter 9,倡导,avocat; initier,L'école a toujours préconisé le tri des ordures pour protéger l'environnement du campus.,Mener un appel à l'action.
Chapter 9,精辟,incisive; pénétrante,Ses paroles étaient une analyse très incisive de ce problème.,Profond et précis.
Chapter 9,金玉良言,conseil d'or; perles de sagesse,Les paroles de vos anciens sont toutes des perles de sagesse; vous devriez les garder à l'esprit.,Des mots très appréciés.
Chapter 9,工作狂,travailaholic,"Pour terminer le projet, il est devenu un vrai ouvrier.",Peut être neutre ou légèrement critique.
Chapter 9,拼命三郎,personne qui travaille désespérément dur,"Récemment, il travaille comme fou, restant au bureau jusqu'à tard tous les soirs.",Du surnom de personnage de Water Margin.
Chapter 9,八九不离十,pas loin; assez proche,Votre estimation était assez proche – le résultat était à peu près ce que vous avez dit.,Rapproximation colloquiale.
Chapter 9,代谢水平,niveau métabolique,"À mesure que les gens vieillissent, leur niveau métabolique diminue progressivement.",Vocabulaire santé et fitness.
Chapter 9,耳边风,mots dans une oreille et dehors l'autre,Il traite souvent les conseils de ses parents comme des mots d'une oreille et de l'autre.,Il s'agit d'ignorer les bons conseils.
Chapter 9,吃老本,vivre des réalisations passées; reposer sur ses lauriers,Vous ne pouvez pas vivre des réalisations passées pour toujours – vous devez continuer à apprendre.,Prévient la complaisance.
Chapter 9,人在江湖，身不由己,dans le monde on ne peut pas toujours faire comme on veut,Le travail est occupé et il y a peu de temps pour la famille — on ne peut pas toujours faire ce qu'on veut.,"Explique les contraintes, et non l'excuse d'une faute."
Chapter 9,朝九晚五,9 à 5 (horaire de travail),De nombreux employés de bureau vivent une vie de neuf à cinq ans.,Un rythme de travail standard.
Chapter 9,日出而作，日落而息,lever au lever du soleil et repos au coucher du soleil,"Après sa retraite à la campagne, il se leva au lever du soleil et se reposa au coucher du soleil, et sa santé s'améliora.",Description classique de la vie rurale.
Chapter 9,反其道而行之,faire le contraire de la manière habituelle,"Pendant que tout le monde reste debout tard, il fait le contraire et garde les premières heures.",Les faits saillants contrastent avec la pratique courante.
Chapter 9,慢性病,maladies chroniques,S'asseoir trop longtemps et rester en retard peut augmenter le risque de maladies chroniques comme la spondylose cervicale et le foie gras.,Comprend
Chapter 9,买后悔药,acheter des médicaments regret (fig.: ne peut pas défaire le passé),Il n'y a nulle part où acheter la médecine de regret – pensez soigneusement avant de décider.,Figuratif; souligne l'irréversibilité.
Chapter 9,金钥匙,clé dorée (fig.: accès privilégié),"Il est entré à l'université par son propre effort, pas par aucune clé d'or.",Souvent sur l'éducation ou la carrière.
Chapter 9,自主性,autonomie; indépendance,"À mesure que les enfants grandissent, les parents doivent progressivement favoriser leur autonomie.",Important en éducation et en psychologie.
