Chapter,hanzi,meaning,example_en,usage_note
Chapter 5,督促,supervisar e instar,Los padres deben instar a sus hijos a terminar la tarea a tiempo.,Impulsa a la acción.
Chapter 5,考级,tomar un examen de grado,Muchos padres llevan a sus hijos para exámenes de piano durante el descanso de verano.,Pruebas de habilidad estandarizadas.
Chapter 5,奢望,esperanza salvaje; demanda extravagante,"Para él, poder comer una comida completa es una esperanza extravagante.",Una expectativa irrealista.
Chapter 5,熏陶,influir (positivamente); educar,Creció en una familia de tradición literaria y recibió una buena influencia cultural tradicional.,Influencia positiva gradual con el tiempo.
Chapter 5,高雅,refinado; elegante,Esta sala de conciertos suele albergar actuaciones artísticas refinadas.,"Describe el gusto, el arte o la manera."
Chapter 5,就业,empleo; conseguir empleo,El gobierno trabaja intensamente para resolver el empleo de los graduados universitarios por varios canales.,Incorporarse al mundo laboral.
Chapter 5,意愿,aspiración; deseo,Debemos respetar las aspiraciones personales de los niños al elegir una carrera.,La propia voluntad.
Chapter 5,苦心,esfuerzo penoso; dedicación,Todavía no puedes comprender del todo el esfuerzo y la dedicación de tus padres.,Mucho cuidado y reflexión.
Chapter 5,期望值,nivel de espera,"Si el nivel de expectativa es demasiado alto, es fácil sentirse frustrado.",Grado de esperanza.
Chapter 5,鹏程万里,tener un futuro brillante por delante,Le deseo progreso académico y un futuro brillante por delante.,idioma congratulatorio común.
Chapter 5,料,esperar; anticipar,"Pensé que hoy no vendría, pero llegó antes de lo previsto.",A menudo se usa con 没/不.
Chapter 5,尽力而为,hacer todo lo posible,"Cualquiera que sea el resultado del examen, si haces todo lo posible no te arrepentirás.","Enfatiza el esfuerzo, no el resultado."
Chapter 5,但愿,Sólo espero; si sólo,Sólo espero que el tiempo esté claro mañana para que nuestra actividad pueda ir sin problemas.,Expresa un deseo sincero.
Chapter 5,成才,ser una persona útil,Los padres trabajan duro sólo para apoyar la educación y el éxito de sus hijos.,Alcanzar potencial.
Chapter 5,包办,tomar el control de todo; organizar para alguien,Los padres no deben organizar cada elección de vida para sus hijos.,A menudo implica sobrecontrol.
Chapter 5,心甘情愿,estar perfectamente dispuesto,"Para dar a su hijo una mejor educación, los padres están perfectamente dispuestos a sufrir dificultades.",Total disposición.
Chapter 5,心态,mentalidad; actitud,"Cuando se enfrentan a dificultades, es importante mantener una mentalidad positiva y optimista.",Estado de ánimo.
Chapter 5,传授,pasar (conocimiento),El viejo profesor desinteresado pasó de conocimiento académico a los jóvenes.,Enseñanza de habilidades / sabiduría.
Chapter 5,撒手,lavar las manos de uno; dejar ir,Los niños han crecido; los padres deben aprender a dejar ir.,Dejar la responsabilidad.
Chapter 5,强加,fuerza sobre,Los padres no deben imponer sus propios deseos a sus hijos.,Sugiere falta de respeto por la voluntad de los demás.
Chapter 5,足够,suficiente; suficiente,"Mientras haya suficiente confianza, ninguna dificultad es insuperable.",Cantidad adecuada.
Chapter 5,后劲,post-efecto; poder persistente,Este vino tiene un fuerte post-efecto; ten cuidado al beber.,Impacto continuo.
Chapter 5,揠苗助长,estropear las cosas acelerando el crecimiento (lit. levantar las plántulas),El aprendizaje debe ser gradual; el progreso acelerado sólo retrocede.,Clásica precaución contra la impaciencia.
Chapter 5,神童,niño prodigio,Su actuación en el concurso de matemáticas llevó a la gente a llamarle prodigio.,Se usa sobre todo para niños con talento precoz.
Chapter 5,了不得,notable; terriblemente (de acuerdo),"Este niño puede recitar docenas de poemas a cinco, notables.",Puede elogiar o enfatizar el grado.
Chapter 5,体验,experiencia (de primera mano),Los escritores suelen ir al campo para experimentar la vida y encontrar inspiración.,Participación personal.
Chapter 5,学业,uno de los estudios; académicos,Espero que avance en sus estudios en el nuevo semestre.,Camino de la educación.
Chapter 5,弱点,punto débil; debilidad,Es demasiado impaciente; esa es su mayor debilidad.,Pata o punto blando.
Chapter 5,人际交往,comunicación interpersonal,"La universidad no es sólo para aprender conocimientos, sino también para practicar la comunicación interpersonal.",Socializar.
Chapter 5,卓越,sobresaliente; brillante,Ha logrado resultados notables en la investigación médica.,Calidad excepcional.
Chapter 5,取决,depender; ser determinado por,Si las calificaciones son buenas depende principalmente de su esfuerzo habitual.,Siempre se usa con À.
Chapter 5,智力,inteligencia,El sueño adecuado es muy importante para el desarrollo intelectual de los adolescentes.,Capacidad mental.
Chapter 5,夸奖,alabanza; elogio,Todos los vecinos lo alabaron por ser un niño sensible.,Aprobación verbal.
Chapter 5,意想不到,inesperado; imprevisto,Este viaje me trajo muchas sorpresas inesperados.,Resultado sorprendente.
Chapter 5,层面,nivel; aspecto,Necesitamos analizar este problema desde múltiples niveles.,Ángulo más profundo o más amplio.
Chapter 5,功利,utilitario; fama y riqueza,La educación no debe ser demasiado utilitaria; debe centrarse en el desarrollo general.,Centrarse en la recompensa.
Chapter 5,挑食,ser exigente con la comida,Los niños que son exigentes con los alimentos pueden fácilmente provocar desequilibrios nutricionales.,hábitos alimenticios negativos.
Chapter 5,娇气,frágiles; chillidos,"La mayoría de los niños de hoy son sólo niños, así que es inevitable que sean un poco frágiles.",Fácilmente molesto o herido.
Chapter 5,脆弱,frágiles; débiles,Su resiliencia mental es bastante frágil y no puede tomar un golpe.,Debilidad física o mental.
Chapter 5,挫折,contratiempos; frustración,"En el camino de la vida, todos encontrarán algunos contratiempos.",Dificultades / fracaso.
Chapter 5,承受,oso; perdura;,"Como médico, uno debe ser capaz de soportar una gran presión de trabajo.",Apoyo al peso o al estrés.
Chapter 5,智商,IQ,"Aunque su coeficiente intelectual es alto, no trabaja duro en estudiar.",Métrico mental.
Chapter 5,情商,EQ,"En el lugar de trabajo, EQ es a menudo más importante que el IQ.",Inteligencia emocional.
Chapter 5,自理,autocuidado; prever uno mismo,Aprendió a cuidarse antes de ir a la universidad.,La independencia personal.
Chapter 5,可怜天下父母心,el amor de los padres por sus hijos es ilimitado,Sólo cuando los niños crecen realmente entienden el amor desinteresado de sus padres.,Línea famosa de un poema; a menudo hablada por los padres.
Chapter 5,三天打鱼两天晒网,trabajo por ajuste y comienzos; falta de persistencia,No se puede estudiar un idioma con ajuste y comienza; practicar todos los días.,Alerta contra la inconsistencia.
Chapter 5,放羊,dejar que los niños corran salvajes; descuidar la supervisión,Los padres no pueden descuidar a sus hijos; la disciplina es necesaria cuando procede.,Metáforo por dejar las ovejas desatendidas.
Chapter 5,吃得苦中苦，方为人上人,sólo por las penurias duraderas puede uno,"Él cree que sólo las dificultades conducen a la excelencia, así que nunca aplaude en el entrenamiento.",Anime la perseverancia.
Chapter 5,望子成龙，望女成凤,Espero que los niños tengan éxito,"Los padres esperan que sus hijos tengan éxito, pero también deben respetar sus intereses.",Expresión común de las expectativas parentales.
Chapter 5,平常心,mentalidad ordinaria; ecuanimidad,Mantenga una mentalidad ordinaria antes de una competencia para realizar a su nivel normal.,Útil para exámenes y competición.
Chapter 5,马拉松,maratón; esfuerzo a largo plazo,"Dominar un idioma es como un maratón, depende de la persistencia.",A menudo se utiliza figurativamente.
Chapter 5,悠着点儿,tómalo con calma; vaya fácil,"Has estado demasiado cansada últimamente, tómatelo con calma y no te empujes.",Un consejo amistoso para frenar.
Chapter 5,老天爷,Cielos; Dios (colloquial),Si esto funciona depende del Cielo ahora.,"Coloquial, no doctrina religiosa."
Chapter 5,豆芽菜,brote de frijol (fig.: delgado niño débil),Los niños deben ejercitar más en lugar de sentarse todo el día y hacerse delgados como brotes de frijol.,Metaforo para el físico frágil.
Chapter 5,小胖墩,pequeño gordito,"Varios chicos chubby corrieron alrededor del jardín de infantes, eran adorables.",Apellido afectuoso.
Chapter 5,衣来伸手，饭来张口,tener todo hecho para uno; ser mimados,El niño es adulto y ya no puede tener todo hecho por ellos.,Crítica la falta de independencia.
Chapter 5,草莓族,Generación de fresas (jóvenes frágiles),La competencia es feroz; los jóvenes no pueden ser frágiles como las fresas.,"Taiwán-origin slang, utilizado críticamente."
Chapter 7,婚纱,vestido de novia,Usar un vestido de novia blanco es el sueño de muchas chicas.,Hermoso de boda.
Chapter 7,折腾,arruinamiento alrededor; desastre alrededor,Se apresuró a salir del hospital antes de recuperarse y terminó enfermando de nuevo del escándalo.,Repetida acción sin fruta.
Chapter 7,如花似玉,tan hermosa como flores y jade,La novia es tan hermosa como flores y jade; todo el mundo alaba su mirada.,idioma clásico para la belleza.
Chapter 7,燕尾服,capa de golondrinas; esmoquin,El conductor caminó sobre el escenario usando un abrigo de golondrinas.,Ropa formal.
Chapter 7,绅士,caballero,Siempre se comporta con una manera muy caballerosa en público.,Forma política y cultural.
Chapter 7,风风雨雨,dificultades; pruebas y tribulaciones,Esta vieja pareja ha pasado por décadas de pruebas y tribulaciones juntos.,Las dificultades de la vida.
Chapter 7,弥补,reparación; reparación,"No importa lo mucho que haga, no puedo compensar la culpa en mi corazón.",Arreglar una brecha o error.
Chapter 7,缺憾,arrepentimiento; defecto; imperfección,"Aunque la boda era perfecta, sus padres no podían asistir, dejando un pequeño arrepentimiento.",A menudo sobre la vida o las relaciones.
Chapter 7,孝心,corazón filial; piedad,Este es el corazón filial del niño; por favor aceptelo.,Intente ser filial.
Chapter 7,清贫,humilde/pobre (pero limpio),Ese viejo profesor vivió una vida humilde pero satisfactoria.,Generalmente se refiere a los intelectuales.
Chapter 7,纯真,puro; inocente,Extraño esa felicidad pura de la infancia más.,Genuine e incorrupted.
Chapter 7,风雨同舟,en el mismo barco; a través de grueso y delgado,"Durante el tiempo más difícil de la compañía, los empleados decidieron estar con el jefe a través de grueso y delgado.",Ayuda mutua en crisis.
Chapter 7,相濡以沫,ayuda mutua en tiempos difíciles,La pareja se ayudó el uno al otro a través de los años difíciles.,Profundo apoyo mutuo.
Chapter 7,酿造,cervecería; crear (metáforicamente),El afecto de una pareja se elabora lentamente a través de la vida cotidiana juntos.,A menudo figurativo para los sentimientos.
Chapter 7,比喻,metáfora; analogía,Al autor le gustaba la juventud al sol a las ocho o nueve de la mañana.,Dispositivo literario.
Chapter 7,贴切,apt; appropriate,Este adjetivo es muy apropiado aquí.,Perfecto para palabras/conceptos.
Chapter 7,秘诀,secreto (de éxito),El trabajo duro y la persistencia son los únicos secretos al éxito.,La clave para un resultado.
Chapter 7,无关紧要,inmaterial; de ninguna consecuencia,"Mientras la dirección general sea correcta, estos detalles son inmateriales.",No es vital.
Chapter 7,包容,tolerar; perdonar; abrazar,Los miembros de la familia deben tolerarse mutuamente y tener más comprensión.,Pensamiento abierto.
Chapter 7,磨合,romper en; encajar en,Los nuevos empleados y el equipo todavía necesitan tiempo para adaptarse.,Nos acostumbramos.
Chapter 7,化解,resolver; disolver,Una sonrisa es la mejor manera de resolver la vergüenza.,Neutralizar un negativo.
Chapter 7,茅塞顿开,repentinamente ver la luz,"Después de la pista del profesor, de repente entendí este problema.",Describe un flash de visión.
Chapter 7,坟墓,tumba;,El matrimonio no es la tumba del amor.,Lugar de descanso final.
Chapter 7,悲剧,tragedia,La codicia es a menudo la causa raíz de la tragedia personal.,Resultado triste o tipo de juego.
Chapter 7,白头到老,envejecer juntos,"En la boda, amigos y familia deseaban que la pareja se envejeciera.",El matrimonio de toda la vida.
Chapter 7,张扬,flaunt; publicize,Es muy bajo y nunca aplaude sus logros en todas partes.,Hacer algo público.
Chapter 7,委曲求全,compromiso por el bien de todo el,"Para mantener la armonía del equipo, tenía que comprometerse.",Auto-sacrificio por una meta.
Chapter 7,同居,cohabitación,Los dos ya habían estado viviendo un año antes de casarse.,Vivir juntos.
Chapter 7,公证,notarización,"Para evitar futuras disputas, fueron a una notarización de propiedades prematrimoniales.",Verificación legal.
Chapter 7,热恋,estar profundamente enamorado,Esta pareja profundamente enamorada planea casarse el próximo año.,Intenso romance.
Chapter 7,违约,incumplimiento del contrato,"Si una de las partes viola el contrato, debe pagar una pena.",Romper un acuerdo.
Chapter 7,明智,sabio; sensible,"Frente a la crisis, tomó una decisión muy sabia.",Buen juicio.
Chapter 7,纠纷,disputa; pelea,Es inevitable que surjan pequeñas disputas entre vecinos.,En constante desacuerdo.
Chapter 7,见外,tratado como un extraño,Todos somos buenos amigos; no seas tan formal/tratame como un extraño.,"Usualmente se usa como ""no sea un extraño""."
Chapter 7,松散,suelto; lax,"Debido a la falta de gestión unificada, la organización de este grupo es floja.",No apretado.
Chapter 7,风吹草动,un alboroto en la hierba; signo de problemas,Esta noticia es muy sensible; cualquier ligero cambio causará fluctuaciones de las acciones.,Primeros signos de cambio.
Chapter 7,冒昧,presuntuoso; tomar la libertad,Me gustaría tomar la libertad de hacerte una pregunta.,Una forma política de intrusión.
Chapter 7,后妈,madrastra,"Aunque es la madrastra, está más cerca del niño que una madre biológica.",Informal para 继.
Chapter 7,松口,relent; suavizar la postura de uno,"Después de largas discusiones, sus padres finalmente se arrepintieron y acordaron dejarle estudiar en el extranjero.",Implica la negativa anterior.
Chapter 7,婆媳,suegra y nuera,Llevar bien la relación madre-hija-en-ley es clave para la armonía familiar.,Dinámica familiar específica.
Chapter 7,乖巧,inteligente y obediente; lindo,Esta niña es bonita y bien hablada; es muy inteligente y obediente.,Bien hecho.
Chapter 7,喜糖,dulces de boda,"En la boda, la pareja entregó dulces de boda a los invitados en agradecimiento.",Símbolo de celebración y de alegría compartida.
Chapter 7,过来人,persona que ha pasado por ella; mano vieja,"En materia de amor, es mejor escuchar consejos de aquellos con experiencia.",Implica sabiduría práctica.
Chapter 7,保鲜,mantener fresco; mantener (relación) vivo,Las parejas necesitan comunicarse a menudo para mantener su relación fresca.,A menudo figurativa para el matrimonio.
Chapter 7,金无足赤，人无完人,Nadie es perfecto,Los cónyuges deben tolerarse entre sí: nadie es perfecto.,Solía excusar defectos menores.
Chapter 7,情人眼里出西施,el amor es ciego (su belleza en los ojos del amante),"En sus ojos, el amor es ciego e incluso pequeños defectos no importan.",Explica afecto sesgado.
Chapter 7,睁一只眼闭一只眼,girar un ojo ciego,"Para una pequeña fricción en el barrio, puedes abrir un ojo ciego.","Sugiere tolerancia, no mala conducta grave."
Chapter 7,难得糊涂,"donde la ignorancia es felicidad, locura para ser sabio","No discutas sobre todos los detalles del hogar, a veces la felicidad es mejor.",Filosofía de dejar ir.
Chapter 7,三思而后行,pensar dos veces antes de actuar,Una decisión tan grande no puede ser impulsiva: debes pensar dos veces.,Un consejo clásico para precaución.
Chapter 7,围城,Fortaleza sitiada ( metáfora del matrimonio),Algunos dicen que el matrimonio es una fortaleza asediada—aquellos dentro y fuera de cada uno tienen sus propios sentimientos.,Del título de novela de Qian Zhongshu.
Chapter 7,丑话说在前头,permítanme ser franco frente a frente; advertencia justa,Seamos francos antes de cooperar para que no haya malentendidos más tarde.,Establece expectativas temprano.
Chapter 7,多了一个心眼儿,ser más cauteloso; tener un ojo extra abierto,"Después de ser engañado la última vez, se volvió más cauteloso en manejar las cosas.",No necesariamente negativo.
Chapter 7,转不过弯来,no se puede conseguir la cabeza alrededor de ella; lento para ajustar,Aún no puede conseguir su cabeza alrededor de la nueva política y necesita tiempo para entender.,Describe la inflexibilidad mental.
Chapter 7,思想工作,trabajo ideológico; persuasión a través de la charla,El maestro de la casa habló con el estudiante para ayudarlo a ajustar su actitud hacia el estudio.,Común en escuelas y lugares de trabajo.
Chapter 7,说到底,cuando todo es dicho y hecho; en el análisis final,"Cuando todo se dice y se hace, los conflictos familiares se reducen a una comunicación insuficiente.",Suma la razón principal.
Chapter 7,和你一起慢慢变老,envejecer juntos contigo,"En la boda, el novio dijo que lo más romántico es envejecer contigo.",De una letra popular.
Chapter 8,壮举,magnífica hazaña; acto heroico,Navegar por el Atlántico fue una hazaña realmente magnífica.,Heroica o gran acción.
Chapter 8,捐,donate,Donó todos sus ahorros de jubilación a la zona de desastre.,Dar a la caridad.
Chapter 8,受宠若惊,ser abrumado por un favor inesperado,"De repente fue recibido por el presidente personalmente, se sintió abrumado por el favor.",Halagado y sorprendido.
Chapter 8,微薄,meager; scanty,"A pesar de sus bajos ingresos, sigue insistiendo en apoyar a un pobre estudiante mensualmente.",Cantidad muy pequeña.
Chapter 8,杯水车薪,una medida totalmente inadecuada,Este pequeño dinero es totalmente inadecuado para una deuda tan enorme.,"Literalmente ""una taza de agua para un carro de madera quemada""."
Chapter 8,贫困,pobreza,El gobierno está tomando medidas para ayudar a la población empobrecida a salir de la pobreza.,La extrema falta de dinero.
Chapter 8,难关,crisis; dificultad,"Con la ayuda de amigos, finalmente logró superar esta crisis financiera.",Barrera para vencer.
Chapter 8,资助,subvencionar; la ayuda financiera,Este empresario ha subvencionado sucesivamente decenas de abandonos.,Apoyo financiero.
Chapter 8,募捐,recaudar fondos; recaudar donaciones,La escuela organizó estudiantes para recaudar fondos para un compañero de clase enfermo.,Recaudación de fondos.
Chapter 8,慰劳,apreciar; recompensa con regalos,Los aldeanos trajeron maní y fruta para recompensar a los trabajadores de la carretera.,Mostrando cuidado para los trabajadores.
Chapter 8,宗旨,objetivo; propósito; misión,La misión de esta asociación es promover el intercambio cultural.,Principio básico de orientación.
Chapter 8,袖手旁观,estar junto con brazos plegados; mirar,"Cuando vemos a otros en problemas, no podemos estar solo de pie y mirar.",Indiferencia a los problemas de los demás.
Chapter 8,五体投地,admirar la sb. al máximo,Su discurso fue brillante; el público lo admiraba completamente.,Elogio hiperbólico.
Chapter 8,将功补过,expiación por uno de los crímenes por buenas obras,Espera expiar sus errores al ganar una medalla de oro en el próximo partido.,Cometiendo un error.
Chapter 8,遵命,obedecer; como usted manda,"Ya que es tu petición, ciertamente obedeceré.",La obediencia formal o humorística.
Chapter 8,残疾,discapacidad; discapacidad,Debemos respetar a las personas con discapacidad y brindarles más comodidad.,Afecto físico.
Chapter 8,盲人,persona ciega,La gente ciega puede leer tocando a Braille.,Persona no vista.
Chapter 8,易如反掌,tan fácil como caer de un tronco,Este problema es tan fácil como caer en un registro para un genio de matemáticas como él.,"Literalmente ""fácil como la palma de uno""."
Chapter 8,小拇指,dedo pequeño; rosado,Su rosado izquierdo está un poco rígido después de la lesión.,Parte de la mano.
Chapter 8,调料,condimento,La adición de vinagre como una sazona cuando la cocina puede mejorar el aroma.,Cocinar ingredientes.
Chapter 8,狼狈,en un estado de pena,Una lluvia repentina dejó a todos en un estado de pena.,Distreso y desordenado.
Chapter 8,跌跌撞撞,escalofriante; tropiezo,"Borracho, se ha estancado el camino a casa.",Movimiento inestable.
Chapter 8,碰壁,golpear una pared de ladrillo; rebuffed,Golpeó una pared de ladrillo por todas partes mientras buscaba un trabajo y se sintió muy deprimido.,Metaforo por falla/rechazo.
Chapter 8,欣慰,gratificada; aliviada y feliz,"Al ver que el niño finalmente se hizo sensible, la madre se sintió muy gratificada.",Sentimiento interno positivo.
Chapter 8,安居,vivir en paz,Sólo con estabilidad social el pueblo puede vivir y trabajar en paz.,Vida segura.
Chapter 8,康复,recuperación; rehabilitación,"Después de un período de tratamiento, su cuerpo se ha recuperado completamente.",Proceso de curación.
Chapter 8,扶贫,alivio de la pobreza,La mitigación de la pobreza dirigida es una importante tarea actual para el país.,Ayudar a los pobres a desarrollarse.
Chapter 8,维权,protección de los derechos,La conciencia de los consumidores de proteger sus derechos aumenta constantemente.,Promoción jurídica.
Chapter 8,助学,ayuda a los estudiantes; apoyo educativo,Espero que la ayuda estudiantil pueda ayudar a los estudiantes pobres a cumplir sus sueños universitarios.,Ayudar a los estudiantes financieramente.
Chapter 8,发放,cuestiones; distribución,Los suministros de socorro en casos de desastre se distribuyen ordenadamente a las víctimas.,Saliendo oficialmente.
Chapter 8,全方位,all-around; omni-directional,Los dos países decidieron llevar a cabo toda la cooperación económica.,Cada ángulo.
Chapter 8,社区,comunidad; barrio,Nuestra comunidad organiza a menudo actividades culturales y deportivas para los ancianos.,Zona residencial local.
Chapter 8,乐呵呵,feliz-go-lucky; sonriente,"El abuelo está sonrientemente feliz todos los días, como si nunca tuviera preocupaciones.",Visible alegría.
Chapter 8,义工,voluntario,"Durante las vacaciones de verano, muchos estudiantes de secundaria trabajan como voluntarios en la biblioteca.",Servicio no pagado.
Chapter 8,素质,calidad (de una persona); carácter,Es muy importante mejorar la calidad científica y cultural de toda la nación.,Cultivo personal.
Chapter 8,集聚,reunir; reunir,Los mejores talentos de investigación científica de la nación se reúnen aquí.,Colección masiva de cosas/personas.
Chapter 8,境界,nivel; estado,Esta pintura muestra un reino artístico muy alto.,Nivel espiritual o profesional.
Chapter 8,有声有色,vívido y dramático; impresionante,Dirigió el trabajo sindical estudiantil en la escuela de una manera impresionante y vívida.,Lleno de vida y éxito.
Chapter 8,认养,adoptar (un árbol/pet/etc.),Los ciudadanos pueden adoptar un pequeño árbol en el parque y ser responsables de cuidarlo.,Tomar responsabilidad por algo.
Chapter 8,捡拾,recoger; recoger,Los voluntarios recogen basura desechada por turistas en la playa.,Reunir artículos del suelo.
Chapter 8,流浪,vagabundos; vagabundos,Una vez vagaba solo en una tierra extranjera cuando era joven.,Sin hogar vagando.
Chapter 8,白血病,leucemia,Todos los sectores de la sociedad recaudan fondos para niños con leucemia para ayudarlos a recibir tratamiento.,Enfermedad grave; común en contextos benéficos.
Chapter 8,不敢当,me halagas; no me lo merezco,"Eres muy amable, realmente no merezco semejante alabanza.",Respuesta política a los cumplidos.
Chapter 8,屋漏偏逢连夜雨,"cuando llueve, se derrama","Acababa de perder su trabajo cuando un miembro de la familia cayó enfermo, la desgracia se apiló.",Expresa mala suerte.
Chapter 8,众人拾柴火焰高,muchas manos hacen trabajo de luz,"La recaudación de fondos necesita la participación de todos, muchas manos hacen trabajo ligero.",Alienta el esfuerzo colectivo.
Chapter 8,爱心社,club de caridad; cuidado de la sociedad,"En la escuela secundaria, organizó muchas ventas de caridad a través de la sociedad cariñosa.",Común en campus en China.
Chapter 8,效犬马之劳,servirte como un perro leal o un caballo,"Si necesitas ayuda, estoy dispuesto a servirte al mejor de mi habilidad.",Oferta formal y humilde de servicio.
Chapter 8,弱势群体,grupos vulnerables; poblaciones desfavorecidas,Los voluntarios visitan regularmente a la comunidad para ofrecer necesidades diarias a los grupos vulnerables.,Mandato oficial y mediático.
Chapter 8,真人秀,reality show,Muchos jóvenes disfrutan de reality shows porque se sienten cerca de la vida cotidiana.,Vocabulario de entretenimiento.
Chapter 8,两眼一抹黑,estar completamente en la oscuridad,"Acababa de entrar en una nueva industria y estaba completamente en la oscuridad, así que tenía que aprender de cero.",Destaca la falta de conocimiento.
Chapter 8,孤寡老人,ancianos sin apoyo familiar,Los voluntarios de la comunidad visitan semanalmente a personas mayores sin apoyo familiar para charlar con ellos.,Social welfare context.
Chapter 8,空巢老人,ancianos vacíos,Muchos ancianos más vacíos necesitan servicios de atención diurna de la comunidad.,Plazo demográfico común.
Chapter 8,临终关怀,cuidado del hospicio; atención al final de la vida,El hospital proporciona atención al final de la vida para que los enfermos terminales puedan salir con dignidad.,vocabulario médico y ético.
