Chapter,hanzi,meaning,example_en,usage_note
Chapter 8,勿以善小而不为,no fallan en hacer el bien porque parece pequeño,La cantidad donada no importa – no deje de hacer el bien porque parece pequeña; cada bit ayuda.,De la enseñanza moral clásica.
Chapter 9,咨询,consultar; solicitar asesoramiento,"Si tiene alguna pregunta, puede llamar al número de consulta.",De investigación profesional.
Chapter 9,体检,examen físico; revisión,"Para la salud, debemos someternos a un control físico una vez al año.",Prueba médica.
Chapter 9,记性,memoria,"A medida que la gente envejece, su memoria empeora y empeora.",Mandato informal para la memoria.
Chapter 9,够呛,insoportable; terrible,Había tanto trabajo hoy; me agotó terriblemente.,Grado extremo.
Chapter 9,总管,gerente; director general,"Es el director de este proyecto, responsable de coordinar a todas las partes.",Líder general.
Chapter 9,担子,carga; carga; responsabilidad,"Como monitor de clase, la carga sobre sus hombros no es luz.",Peso simbólico del deber.
Chapter 9,介于,entre; intermedio,Este color está entre rojo y morado.,Posición en un rango.
Chapter 9,减退,declive; abate,"A medida que aumenta la edad, la audiencia disminuirá gradualmente.",Disminuir la fuerza.
Chapter 9,疲乏,fatigado; cansado,"Después del largo viaje, se sintió muy fatigado.",Cansancio físico.
Chapter 9,健忘,olvidadizo,"Debido a demasiada presión últimamente, se ha vuelto un poco olvidadizo.",Propensa a olvidar.
Chapter 9,不良,malo; dañino; poco saludable,Mantenerse despierto a largo plazo es un hábito poco saludable que es muy malo para el cuerpo.,Calidad negativa.
Chapter 9,酗酒,alcoholismo,La bebida excesiva no sólo daña el cuerpo sino que también puede causar problemas sociales.,Abuso de alcohol.
Chapter 9,膳食,dieta; comida,Una dieta razonable es crucial para mantener una buena salud.,Plazo formal para comidas/nutrición.
Chapter 9,失衡,desequilibrio; fuera del equilibrio,Esta forma de comer llevará a un desequilibrio de elementos de traza en el cuerpo.,Pérdida de equilibrio.
Chapter 9,祸根,raíz del problema; bane,Los hábitos alimenticios poco saludables son la causa raíz de muchas enfermedades.,Origen del desastre.
Chapter 9,应酬,socialización; cena de fiesta,Tiene compromisos sociales todas las noches y raramente come en casa.,Obligación empresarial/social.
Chapter 9,硬撑,mantenerse fuera; mantenerse al día a pesar de las dificultades,"Si estás enfermo, deberías descansar; no te obligues a ir a trabajar.",Luchando por continuar.
Chapter 9,天长日久,después de mucho tiempo; a lo largo de los años,"Mientras persista durante un largo período, seguramente tendrá éxito.",Duración.
Chapter 9,恶果,mala consecuencia; mal resultado,Los actos de destrucción ambiental producirán eventualmente graves consecuencias.,Resultado de malas acciones.
Chapter 9,屡见不鲜,nada nuevo; ocurrencia común,"En la era de Internet, los incidentes de fuga de datos ya son una ocurrencia común.",Visto a menudo.
Chapter 9,延续,continue; go on; last,Esta antigua tradición ha continuado hasta hoy.,Ampliación ininterrumpida.
Chapter 9,全天候,all-weather; round-the-clock,Esta tienda de conveniencia proporciona servicio de vuelta a la hora.,Servicio/operación continuo.
Chapter 9,熬夜,permanecer arriba tarde; permanecer despierto toda la noche,"Para terminar este informe, se quedó hasta las 3 de la mañana de anoche.",Dormir tarde/no.
Chapter 9,宵夜,snack de medianoche; cena,"Después de ver la película, vamos a conseguir un aperitivo de medianoche juntos.",Comida nocturna tardía.
Chapter 9,满满当当,lleno al borde; empacado,Su horario está lleno todos los días.,No queda espacio.
Chapter 9,透支,overdraw; overexert,El exceso de trabajo pondrá el cuerpo en un estado de sobreexerción/drain severa.,Usando más de lo disponible.
Chapter 9,张弛有度,equilibrio entre trabajo y descanso,Los métodos de estudio científico deben incluir un equilibrio entre el trabajo y el descanso.,"Literal: ""tensión y relajación en medida""."
Chapter 9,基因,gene,La investigación científica ha encontrado que la altura está determinada en gran medida por los genes.,Unidad biológica.
Chapter 9,遗传,heredidad; hereditario,Esta enfermedad tiene una clara tendencia hereditaria familiar.,Paso biológico de rasgos.
Chapter 9,吓唬,miedo; miedo,"Te está asustando, no te lo tomes en serio.",Intimidación (informal).
Chapter 9,语重心长,sincera y seria; asesoramiento significativo,"Antes de irme, el profesor me aconsejó seriamente cuidarme.",Profundamente sentido discurso.
Chapter 9,灵丹妙药,medicina milagrosa; panacea,El ejercicio es una medicina milagrosa para mantener la salud.,Cure-all (a menudo utilizado figurativamente).
Chapter 9,均衡,equilibrada; incluso,Debemos mantener una nutrición equilibrada y comer más frutas y verduras.,Incluso distribución.
Chapter 9,开朗,alegre; optimista,Es una chica alegre; a todos les gusta ser amigos con ella.,Sunny disposición.
Chapter 9,平和,suave; suave; calma,Su actitud es siempre muy tranquila cuando se manejan los conflictos.,No es agresivo.
Chapter 9,神清气爽,refrescante; cabeza clara y refrescante,Tomar un paseo por las montañas en la madrugada hace que uno se sienta refrescado.,Frescura mental/física.
Chapter 9,倡导,la abogacía;,La escuela siempre ha defendido la clasificación de basura para proteger el entorno del campus.,Dirigiendo un llamado a la acción.
Chapter 9,精辟,incisivo; penetrante,Sus palabras fueron un análisis muy incisivo de este problema.,Profundo y preciso.
Chapter 9,金玉良言,consejo de oro; perlas de sabiduría,Las palabras de tus ancianos son todas perlas de sabiduría; debes tenerlas en mente.,Palabras muy valoradas.
Chapter 9,工作狂,trabajoatólica,"Para terminar el proyecto, se convirtió en un verdadero trabajador.",Puede ser neutral o ligeramente crítico.
Chapter 9,拼命三郎,persona que trabaja desesperadamente duro,"Últimamente trabaja como loco, permaneciendo en la oficina hasta tarde cada noche.",De Water Margin personaje apodo.
Chapter 9,八九不离十,no lejos; bastante cerca,Tu estimación fue bastante cercana: el resultado fue aproximadamente lo que dijiste.,aproximación coloquial.
Chapter 9,代谢水平,nivel metabólico,"A medida que la gente envejece, su nivel metabólico disminuye gradualmente.",Vocabulario de salud y fitness.
Chapter 9,耳边风,palabras en un oído y fuera el otro,A menudo trata el consejo de sus padres como palabras en un oído y fuera del otro.,Implica ignorar el buen consejo.
Chapter 9,吃老本,vivir de logros pasados; descansar en los laureles,Usted no puede vivir de logros pasados para siempre - usted debe seguir aprendiendo.,advierte contra la complacencia.
Chapter 9,人在江湖，身不由己,en el mundo uno no puede siempre hacer como uno desea,El trabajo está ocupado y hay poco tiempo para la familia — uno no siempre puede hacer lo que uno quiere.,"Explica limitaciones, no excusa para hacer mal."
Chapter 9,朝九晚五,9 a 5 (programa de trabajo),Muchos trabajadores de oficina viven una vida de nueve a cinco.,Ritmo de trabajo estándar.
Chapter 9,日出而作，日落而息,levantarse al amanecer y descansar al atardecer,"Después de retirarse al campo, se levantó al amanecer y se descansó al atardecer, y su salud mejoró.",Descripción clásica de la vida rural.
Chapter 9,反其道而行之,hacer lo contrario de la manera habitual,"Mientras todos se levantan tarde, hace lo contrario y se mantiene temprano.",Destaca el contraste con la práctica común.
Chapter 9,慢性病,Enfermedad crónica,Sentarse demasiado tiempo y permanecer hasta tarde puede aumentar el riesgo de enfermedades crónicas como la espondilosis cervical y el hígado graso.,"Includes  molecular, optimización inmediatamente posterior, entendido como"
Chapter 9,买后悔药,comprar medicamentos de arrepentimiento (fig.: no puede deshacer el pasado),No hay lugar para comprar la medicina de arrepentimiento—pensar cuidadosamente antes de decidir.,Figurativo; enfatiza la irreversibilidad.
Chapter 9,金钥匙,llave dorada (fig.: acceso privilegiado),"Se metió en la universidad a través de su propio esfuerzo, no a través de ninguna llave dorada.",A menudo sobre educación o carrera.
Chapter 9,自主性,autonomía; independencia,"A medida que crecen los niños, los padres deben fomentar gradualmente su autonomía.",Importante en educación y psicología.
